{
  "schemaVersion": "1.0.0",
  "id": "pull-yourself-together",
  "name": "Pull Yourself Together",
  "tier": 2,
  "effect": "-15% battle-spell and equipment-active cooldown.",
  "sources": [
    {
      "field": "stats",
      "url": "https://mobile-legends.fandom.com/wiki/Emblems",
      "retrieved": "2026-06-29"
    }
  ]
}
