{
  "schemaVersion": "1.0.0",
  "id": "wilderness-blessing",
  "name": "Wilderness Blessing",
  "tier": 2,
  "effect": "+10% movement speed in river/jungle (halved for a few seconds after hero combat).",
  "sources": [
    {
      "field": "stats",
      "url": "https://mobile-legends.fandom.com/wiki/Emblems",
      "retrieved": "2026-06-29"
    }
  ]
}
